{
  "schema_version": "1.0",
  "host": "bobs-mbp.local",
  "score": 0,
  "generated_at": "2026-07-07T08:00:00Z",
  "status": "waiting-for-network",
  "offline": true,
  "checkers": [
    { "id": "startup-network-check", "severity": "warn", "destructive": false, "detail": "network not yet available; startup check pending" }
  ],
  "auth": []
}
