{
  "schema_version": "1.0",
  "host": "bobs-mbp.local",
  "score": 90,
  "generated_at": "2026-07-07T14:32:00Z",
  "status": "updating-app",
  "offline": false,
  "checkers": [
    { "id": "cli-foundation-version", "severity": "warn", "destructive": false, "layer": "foundation", "product": "cli", "detail": "Control Tower self-update applying 1.2.0 -> 1.3.0" }
  ],
  "auth": []
}
