{
  "schema_version": "1.0",
  "host": "bobs-mbp.local",
  "score": 70,
  "generated_at": "2026-07-07T14:32:00Z",
  "status": "signed-out",
  "offline": false,
  "checkers": [
    { "id": "knowledge-org-sync", "severity": "pass", "destructive": false, "layer": "org", "product": "knowledge", "detail": "org tip matches remote" },
    { "id": "cli-foundation-version", "severity": "pass", "destructive": false, "layer": "foundation", "product": "cli", "detail": "cc 1.3.0 up to date" },
    { "id": "claude-personal-agents", "severity": "warn", "destructive": false, "layer": "personal", "product": "claude", "detail": "signed out; cannot verify personal overrides", "repair": "cc auth login" }
  ],
  "auth": [
    { "identity": "bob@acme.com", "scope": "personal", "state": "expired", "expires_at": "2026-07-05T00:00:00Z" }
  ]
}
