{
  "schema_version": "1.0",
  "host": "bobs-mbp.local",
  "score": 88,
  "generated_at": "2026-07-07T14:32:00Z",
  "status": "update-available",
  "offline": false,
  "checkers": [
    { "id": "cli-foundation-version", "severity": "warn", "destructive": false, "layer": "foundation", "product": "cli", "detail": "cc 1.2.9 -> 1.3.0 available", "repair": "cc update", "local_sha": "c3d4e5f", "remote_sha": "d4e5f6a" },
    { "id": "knowledge-org-sync", "severity": "pass", "destructive": false, "layer": "org", "product": "knowledge", "detail": "org tip matches remote" },
    { "id": "claude-personal-agents", "severity": "pass", "destructive": false, "layer": "personal", "product": "claude", "detail": "personal agent overrides applied" }
  ],
  "auth": []
}
