{
  "schema_version": "1.0",
  "host": "bobs-mbp.local",
  "score": 30,
  "generated_at": "2026-07-07T14:32:00Z",
  "status": "it-config-incomplete",
  "offline": false,
  "checkers": [
    { "id": "knowledge-org-sync", "severity": "fail", "destructive": true, "layer": "org", "product": "knowledge", "detail": "org MDM policy missing required secret-store endpoint", "escalate": "it" },
    { "id": "cli-foundation-version", "severity": "pass", "destructive": false, "layer": "foundation", "product": "cli", "detail": "cc 1.3.0 up to date" }
  ],
  "auth": [
    { "identity": "org-svc@acme.com", "scope": "org", "state": "revoked", "expires_at": "2026-06-01T00:00:00Z" }
  ]
}
