{
  "schema_version": "1.0",
  "host": "bobs-mbp.local",
  "score": 80,
  "generated_at": "2026-07-07T14:32:00Z",
  "status": "syncing",
  "offline": false,
  "checkers": [
    { "id": "knowledge-org-sync", "severity": "warn", "destructive": false, "layer": "org", "product": "knowledge", "detail": "syncing org tier, 42% complete" },
    { "id": "claude-personal-agents", "severity": "pass", "destructive": false, "layer": "personal", "product": "claude", "detail": "personal agent overrides applied" },
    { "id": "cli-foundation-version", "severity": "pass", "destructive": false, "layer": "foundation", "product": "cli", "detail": "cc 1.3.0 up to date" }
  ],
  "auth": []
}
